<?xml version="1.0" encoding="UTF-8"?>
<xs:schema attributeFormDefault="unqualified" elementFormDefault="qualified" xmlns:xs="http://www.w3.org/2001/XMLSchema">
  <xs:element name="countries" type="countriesType"/>
  <xs:complexType name="countryType">
    <xs:sequence>
      <xs:element type="xs:string" name="name"/>
      <xs:element type="xs:string" name="countryCode"/>
    </xs:sequence>
  </xs:complexType>
  <xs:complexType name="countriesType">
    <xs:sequence>
      <xs:element type="countryType" name="country" maxOccurs="unbounded" minOccurs="1"/>
    </xs:sequence>
  </xs:complexType>
</xs:schema>